<?xml version="1.0" encoding="UTF-8"?>
<?xml-stylesheet type="text/xsl" href="grddl.xsl"?>
<sk:Akt xmlns:sk="http://www.ftn.uns.ac.rs/skupstina"
    xmlns:xsi="http://www.w3.org/2001/XMLSchema-instance"
    xmlns="http://www.w3.org/ns/rdfa#" 
    xmlns:pred="http://www.ftn.uns.ac.rs/rdf/examples/predicate/"
    xsi:schemaLocation="http://www.ftn.uns.ac.rs/skupstina ../xsd/akt.xsd">
    <sk:MetaPodaci vocab="http://www.ftn.uns.ac.rs/rdf/examples/predicate/" 
    	about="/zakon_o_izvrsenju_i_obezbedjenju">
        <sk:DtPredlaganja property="pred:predlozen" datatype="xsi:date">1965-08-17</sk:DtPredlaganja>
        <sk:BrClanova property="pred:brakt" datatype="xsi:string">12</sk:BrClanova>
    </sk:MetaPodaci>
    <sk:Naslov>ЗАКОН О ИЗВРШЕЊУ И ОБЕЗБЕЂЕЊУ</sk:Naslov>
    <sk:Deo Redni_broj="2" Naziv="ОПШТА ПРАВИЛА ИЗВРШНОГ ПОСТУПКА">
        <sk:Glava Redni_broj="1" Naziv="ИЗВРШНА И ВЕРОДОСТОЈНА ИСПРАВА">
            <sk:Odeljak Redni_broj="1" Naziv="1. Основи за доношење решења о извршењу">
                <sk:Clan Brojcana_oznaka="40" Naziv="">
                    <sk:Stav> ĐĆ </sk:Stav>
                </sk:Clan>
            </sk:Odeljak>
            <sk:Odeljak Redni_broj="2" Naziv="2. Извршна исправа">
                <sk:Clan Brojcana_oznaka="41" Naziv="Врсте извршних исправа">
                    <sk:Stav> Извршне исправе јесу: <sk:Tacka Redni_broj="1">1) извршна судска
                            одлука и судско поравнање који гласе на давање, чињење, нечињење или
                            трпљење;</sk:Tacka>
                        <sk:Tacka Redni_broj="2">2) извршна одлука донета у прекршајном или управном
                            поступку и управно поравнање који гласе на новчану обавезу ако посебним
                            законом није друкчије одређено;</sk:Tacka>
                    </sk:Stav>
                </sk:Clan>
            </sk:Odeljak>
        </sk:Glava>
        <sk:Glava Redni_broj="2" Naziv="СРЕДСТВА И ПРЕДМЕТ ИЗВРШЕЊА">
            <sk:Clan Brojcana_oznaka="54" Naziv="Средства извршења">
                <sk:Stav>Средства извршења су радње којима се намирује потраживање извршног
                    повериоца.</sk:Stav>
                <sk:Stav>Средства извршења ради намирења новчаног потраживања јесу: продаја
                    непокретности извршног дужника, продаја покретних ствари извршног дужника,
                    пренос новчаног потраживања извршног дужника, пренос зараде извршног дужника,
                    пренос новчаних средстава с рачуна извршног дужника код банке, пренос средстава
                    са штедног улога или текућег рачуна извршног дужника, продаја финансијских
                    инструмената извршног дужника, продаја удела извршног дужника у привредним
                    субјектима и пренос потраживања извршног дужника да му се предају или испоруче
                    покретне ствари или преда непокретност.</sk:Stav>
                <sk:Stav>Средства извршења ради остваривања неновчаног потраживања јесу: предаја
                    покретних ствари извршног дужника, испражњење и предаја непокретности извршног
                    дужника, чињење, нечињење или трпљење извршног дужника, предаја детета и
                    извршење других одлука у вези с породичним односима, враћање запосленог на рад,
                    деоба сувласничке ствари и издејствовање изјаве воље.</sk:Stav>
            </sk:Clan>
            <sk:Clan Brojcana_oznaka="55" Naziv="Предмети извршења">
                <sk:Stav>Предмети извршења су ствари и права извршног дужника на којима се спроводи
                    извршење.</sk:Stav>
                <sk:Stav>Предмет извршења не могу бити ствари изван промета, објекти, оружје и
                    опрема који су намењени одбрани и безбедности Републике Србије, нити ствари које
                    су овим или другим законом изузете од извршења.</sk:Stav>
            </sk:Clan>
        </sk:Glava>
    </sk:Deo>
    <sk:Deo Redni_broj="2">
        <sk:Glava Redni_broj="1" Naziv="">
            <sk:Clan Brojcana_oznaka="1" Naziv="Предмет закона">
                <sk:Stav> Овим законом уређује се поступак у коме судови и јавни извршитељи принудно
                    намирују потраживања извршних поверилаца заснoвана на извршним и веродостојним
                    исправама (извршни поступак), поступак обезбеђења потраживања и положај јавних
                    извршитеља. </sk:Stav>
            </sk:Clan>
            <sk:Clan Brojcana_oznaka="2" Naziv="Значење појединих израза">
                <sk:Stav> Поједини изрази који се користе у овом закону имају следеће значење:
                        <sk:Tacka Redni_broj="1">1) „потраживање” означава право извршног повериоца
                        да захтева од извршног дужника одређено давање, чињење, нечињење или
                        трпљење;</sk:Tacka>
                    <sk:Tacka Redni_broj="2">2) „извршни поверилац” означава лице чије се
                        потраживање намирује у извршном поступку или обезбеђује у поступку
                        обезбеђења;</sk:Tacka>
                </sk:Stav>
            </sk:Clan>
        </sk:Glava>
        <sk:Glava Redni_broj="2" Naziv="">
            <sk:Clan Brojcana_oznaka="3"
                Naziv="Покретање и вођење извршног поступка и поступка обезбеђења">
                <sk:Stav> Извршни поступак и поступак обезбеђења покрећу се тако што извршни
                    поверилац подноси предлог за извршење на основу извршне или веродостојне исправе
                    или предлог за обезбеђење, а по службеној дужности покрећу се само ако је
                    законом одређено. </sk:Stav>
            </sk:Clan>
            <sk:Clan Brojcana_oznaka="4" Naziv="Надлежност за спровођење извршења">
                <sk:Stav> Суд је искључиво надлежан за извршење заједничке продаје непокретности и
                    покретних ствари, чињења, нечињења или трпљења (чл. 359–367) и извршење извршних
                    исправа у вези с породичним односима и враћањем запосленог на рад. </sk:Stav>
            </sk:Clan>
        </sk:Glava>
    </sk:Deo>
</sk:Akt>
